{
  "$schema": "https://json-schema.org/draft/2020-12/schema",
  "$id": "https://piricad.org/data/catalogs/schema/ai-saglayicilar.schema.json",
  "title": "PiriCAD yapay zeka sağlayıcı kataloğu",
  "description": "Programın konuşmayı bildiği model uç noktaları: adres, kimlik başlığı, lehçe ve o sağlayıcının sunduğu modeller. Bir model kimliği ya da adres değiştiğinde bu dosya güncellenir; yeniden derleme gerekmez.",
  "type": "object",
  "required": ["schema_version", "package_version", "id", "source", "published", "licence", "saglayicilar"],
  "additionalProperties": false,
  "properties": {
    "schema_version": { "type": "integer", "minimum": 1 },
    "package_version": { "type": "string", "pattern": "^[0-9]+\\.[0-9]+\\.[0-9]+$" },
    "id": { "type": "string" },
    "source": { "type": "string", "description": "Hangi belgelerden, hangi tarihte derlendiği." },
    "published": { "type": "string", "format": "date" },
    "licence": { "type": "string" },
    "aciklama": { "type": "string" },
    "saglayicilar": {
      "type": "array",
      "minItems": 1,
      "items": {
        "type": "object",
        "required": ["kimlik", "ad", "lehce", "adres", "yol", "modeller"],
        "additionalProperties": false,
        "properties": {
          "kimlik": { "description": "Küçük harf ASCII kısa ad; kataloğun içinde tekildir.", "type": "string", "pattern": "^[a-z0-9_]+$" },
          "ad": { "description": "Sağlayıcının kendini yazdığı ad; seçicide görünen budur.", "type": "string", "minLength": 1 },
          "lehce": { "type": "string", "enum": ["openai_chat", "openai_responses", "anthropic_messages", "ollama_native"] },
          "adres": { "description": "Şema, konak, port ve sürüm öneki. Sonda eğik çizgi yoktur.", "type": "string", "pattern": "^https?://[^ ]+$" },
          "yol": { "description": "Sohbet uç noktasının adres altındaki yolu.", "type": "string", "pattern": "^/" },
          "kimlik_baslik": { "description": "Kimlik bilgisini taşıyan başlık. Boş dizge 'kimlik istemiyor' demektir ve yerel sunucular için doğrudur.", "type": "string" },
          "kimlik_onek": { "description": "Kimlikten önce gelen sözcük. Anthropic çıplak anahtar alır, yani boştur.", "type": "string" },
          "ek_basliklar": {
            "type": "array",
            "items": {
              "type": "object",
              "required": ["ad", "deger"],
              "additionalProperties": false,
              "properties": { "ad": { "type": "string" }, "deger": { "type": "string" } }
            }
          },
          "anahtar_ref": { "description": "Anahtarı TUTAN kaydın adı. Anahtarın kendisi bu dosyaya asla yazılmaz (CLAUDE.md 5.21).", "type": "string" },
          "anahtar_ortam": { "description": "Sağlayıcının kendi belgelerinin tanımlattığı ortam değişkeni.", "type": "string" },
          "model_listesi_yolu": { "description": "Adres altında modelleri LİSTELEYEN yol; sağlayıcıda yoksa boştur.", "type": "string" },
          "model_listesi_bicimi": { "type": "string", "enum": ["yok", "openai", "ollama", "anthropic"] },
          "belge": { "description": "Sağlayıcının kendi API başvurusu.", "type": "string" },
          "yerel": { "description": "Kullanıcının kendi makinesinde ya da kurum ağında çalışır; hassas projede izinlidir.", "type": "boolean" },
          "baslangic": { "description": "Yeni kurulum bu sağlayıcı için bir profille başlar.", "type": "boolean" },
          "not": { "type": "string" },
          "modeller": {
            "type": "array",
            "minItems": 1,
            "items": {
              "type": "object",
              "required": ["kimlik"],
              "additionalProperties": false,
              "properties": {
                "kimlik": { "description": "Tel üzerinde gönderilen tam model kimliği.", "type": "string", "minLength": 1 },
                "etiket": { "type": "string" },
                "baglam": { "description": "Bağlam penceresi, jeton. 0 bilinmiyor demektir.", "type": "integer", "minimum": 0 },
                "azami_cikti": { "description": "Çıktı jeton sınırı. 0 'bu alanı hiç gönderme' demektir.", "type": "integer", "minimum": 0 },
                "dusunur": { "description": "Düşünen (reasoning) model mi.", "type": "boolean" }
              }
            }
          }
        }
      }
    }
  }
}
