{
  "schema_version": 1,
  "package_version": "2026.9.19",
  "id": "ai-saglayicilar",
  "source": "Sağlayıcıların kendi API başvuru belgeleri; her kaydın 'belge' alanı kaynağını gösterir. 2026-09-19 tarihinde derlendi.",
  "published": "2026-09-19",
  "licence": "Bu dosya PiriCAD'in kendi derlemesidir (GPL-3.0-or-later). Model ve marka adları sahiplerine aittir.",
  "aciklama": "Model kimlikleri ve adresler hızla eskir. Bu dosya programın BİLDİĞİ listedir; uç noktanın o an SUNDUĞU liste 'Modelleri getir' ile alınır ve bunun yerine geçer.",
  "saglayicilar": [
    {
      "kimlik": "ollama",
      "ad": "Ollama",
      "lehce": "ollama_native",
      "adres": "http://localhost:11434",
      "yol": "/api/chat",
      "kimlik_baslik": "",
      "kimlik_onek": "",
      "model_listesi_yolu": "/api/tags",
      "model_listesi_bicimi": "ollama",
      "belge": "https://github.com/ollama/ollama/blob/main/docs/api.md",
      "yerel": true,
      "baslangic": true,
      "modeller": [
        {
          "kimlik": "llama3.1",
          "etiket": "Llama 3.1 8B",
          "baglam": 131072
        },
        {
          "kimlik": "qwen2.5:14b",
          "etiket": "Qwen2.5 14B",
          "baglam": 32768
        },
        {
          "kimlik": "gemma3:12b",
          "etiket": "Gemma 3 12B",
          "baglam": 131072
        },
        {
          "kimlik": "mistral-nemo",
          "etiket": "Mistral NeMo",
          "baglam": 131072
        },
        {
          "kimlik": "deepseek-r1:14b",
          "etiket": "DeepSeek-R1 damıtık",
          "baglam": 131072,
          "dusunur": true
        },
        {
          "kimlik": "phi4",
          "etiket": "Phi-4",
          "baglam": 16384
        }
      ]
    },
    {
      "kimlik": "ollama_openai",
      "ad": "Ollama (OpenAI uyumlu)",
      "lehce": "openai_chat",
      "adres": "http://localhost:11434/v1",
      "yol": "/chat/completions",
      "kimlik_baslik": "",
      "kimlik_onek": "",
      "model_listesi_yolu": "/models",
      "model_listesi_bicimi": "openai",
      "belge": "https://github.com/ollama/ollama/blob/main/docs/openai.md",
      "yerel": true,
      "modeller": [
        {
          "kimlik": "llama3.1",
          "etiket": "Llama 3.1 8B",
          "baglam": 131072
        },
        {
          "kimlik": "qwen2.5:14b",
          "etiket": "Qwen2.5 14B",
          "baglam": 32768
        }
      ]
    },
    {
      "kimlik": "llamacpp",
      "ad": "llama.cpp (llama-server)",
      "lehce": "openai_chat",
      "adres": "http://localhost:8080/v1",
      "yol": "/chat/completions",
      "kimlik_baslik": "",
      "kimlik_onek": "",
      "model_listesi_yolu": "/models",
      "model_listesi_bicimi": "openai",
      "belge": "https://github.com/ggml-org/llama.cpp/tree/master/tools/server",
      "yerel": true,
      "not": "Model adı yok sayılır; sunucu komut satırında yüklenen modeli kullanır.",
      "modeller": [
        {
          "kimlik": "local-model",
          "etiket": "Sunucuya yüklenmiş model"
        }
      ]
    },
    {
      "kimlik": "lmstudio",
      "ad": "LM Studio",
      "lehce": "openai_chat",
      "adres": "http://localhost:1234/v1",
      "yol": "/chat/completions",
      "kimlik_baslik": "",
      "kimlik_onek": "",
      "model_listesi_yolu": "/models",
      "model_listesi_bicimi": "openai",
      "belge": "https://lmstudio.ai/docs/app/api/endpoints/openai",
      "yerel": true,
      "modeller": [
        {
          "kimlik": "local-model",
          "etiket": "Yüklü model"
        }
      ]
    },
    {
      "kimlik": "vllm",
      "ad": "vLLM",
      "lehce": "openai_chat",
      "adres": "http://localhost:8000/v1",
      "yol": "/chat/completions",
      "kimlik_baslik": "",
      "kimlik_onek": "",
      "model_listesi_yolu": "/models",
      "model_listesi_bicimi": "openai",
      "belge": "https://docs.vllm.ai/en/latest/serving/openai_compatible_server.html",
      "yerel": true,
      "not": "vLLM SUNULAN model adını birebir arar; başka bir ad 404 verir.",
      "modeller": [
        {
          "kimlik": "Qwen/Qwen2.5-7B-Instruct",
          "etiket": "Örnek; --model ile ne yüklediyseniz o",
          "baglam": 32768
        }
      ]
    },
    {
      "kimlik": "sglang",
      "ad": "SGLang",
      "lehce": "openai_chat",
      "adres": "http://localhost:30000/v1",
      "yol": "/chat/completions",
      "kimlik_baslik": "",
      "kimlik_onek": "",
      "model_listesi_yolu": "/models",
      "model_listesi_bicimi": "openai",
      "belge": "https://docs.sglang.ai/basic_usage/openai_api.html",
      "yerel": true,
      "modeller": [
        {
          "kimlik": "default",
          "etiket": "Sunucuya yüklenmiş model"
        }
      ]
    },
    {
      "kimlik": "tgi",
      "ad": "Hugging Face TGI",
      "lehce": "openai_chat",
      "adres": "http://localhost:8080/v1",
      "yol": "/chat/completions",
      "kimlik_baslik": "",
      "kimlik_onek": "",
      "model_listesi_yolu": "/models",
      "model_listesi_bicimi": "openai",
      "belge": "https://huggingface.co/docs/text-generation-inference/messages_api",
      "yerel": true,
      "modeller": [
        {
          "kimlik": "tgi",
          "etiket": "Sunucuya yüklenmiş model"
        }
      ]
    },
    {
      "kimlik": "localai",
      "ad": "LocalAI",
      "lehce": "openai_chat",
      "adres": "http://localhost:8080/v1",
      "yol": "/chat/completions",
      "kimlik_baslik": "",
      "kimlik_onek": "",
      "model_listesi_yolu": "/models",
      "model_listesi_bicimi": "openai",
      "belge": "https://localai.io/features/openai-functions/",
      "yerel": true,
      "modeller": [
        {
          "kimlik": "gpt-4",
          "etiket": "LocalAI takma adı"
        }
      ]
    },
    {
      "kimlik": "jan",
      "ad": "Jan",
      "lehce": "openai_chat",
      "adres": "http://localhost:1337/v1",
      "yol": "/chat/completions",
      "kimlik_baslik": "",
      "kimlik_onek": "",
      "model_listesi_yolu": "/models",
      "model_listesi_bicimi": "openai",
      "belge": "https://jan.ai/docs/api-server",
      "yerel": true,
      "modeller": [
        {
          "kimlik": "local-model",
          "etiket": "Yüklü model"
        }
      ]
    },
    {
      "kimlik": "litellm",
      "ad": "LiteLLM ağ geçidi",
      "lehce": "openai_chat",
      "adres": "http://localhost:4000/v1",
      "yol": "/chat/completions",
      "anahtar_ref": "litellm",
      "anahtar_ortam": "LITELLM_API_KEY",
      "model_listesi_yolu": "/models",
      "model_listesi_bicimi": "openai",
      "belge": "https://docs.litellm.ai/docs/simple_proxy",
      "yerel": true,
      "not": "Model adı geçidin kendi yapılandırmasındaki addır, sağlayıcının değil.",
      "modeller": [
        {
          "kimlik": "gpt-4o",
          "etiket": "Geçidin config.yaml'inde tanımlı ad"
        }
      ]
    },
    {
      "kimlik": "openai_responses",
      "ad": "OpenAI (Responses)",
      "lehce": "openai_responses",
      "adres": "https://api.openai.com/v1",
      "yol": "/responses",
      "anahtar_ref": "openai",
      "anahtar_ortam": "OPENAI_API_KEY",
      "model_listesi_yolu": "/models",
      "model_listesi_bicimi": "openai",
      "belge": "https://platform.openai.com/docs/api-reference/responses",
      "baslangic": true,
      "modeller": [
        {
          "kimlik": "gpt-5",
          "etiket": "GPT-5",
          "baglam": 400000,
          "azami_cikti": 128000,
          "dusunur": true
        },
        {
          "kimlik": "gpt-5-mini",
          "etiket": "GPT-5 mini",
          "baglam": 400000,
          "azami_cikti": 128000,
          "dusunur": true
        },
        {
          "kimlik": "gpt-5-nano",
          "etiket": "GPT-5 nano",
          "baglam": 400000,
          "azami_cikti": 128000,
          "dusunur": true
        },
        {
          "kimlik": "o4-mini",
          "etiket": "o4-mini",
          "baglam": 200000,
          "azami_cikti": 100000,
          "dusunur": true
        },
        {
          "kimlik": "o3",
          "etiket": "o3",
          "baglam": 200000,
          "azami_cikti": 100000,
          "dusunur": true
        },
        {
          "kimlik": "gpt-4.1",
          "etiket": "GPT-4.1",
          "baglam": 1047576,
          "azami_cikti": 32768
        },
        {
          "kimlik": "gpt-4.1-mini",
          "etiket": "GPT-4.1 mini",
          "baglam": 1047576,
          "azami_cikti": 32768
        },
        {
          "kimlik": "gpt-4o",
          "etiket": "GPT-4o",
          "baglam": 128000,
          "azami_cikti": 16384
        }
      ]
    },
    {
      "kimlik": "openai_chat",
      "ad": "OpenAI (Sohbet)",
      "lehce": "openai_chat",
      "adres": "https://api.openai.com/v1",
      "yol": "/chat/completions",
      "anahtar_ref": "openai",
      "anahtar_ortam": "OPENAI_API_KEY",
      "model_listesi_yolu": "/models",
      "model_listesi_bicimi": "openai",
      "belge": "https://platform.openai.com/docs/api-reference/chat",
      "modeller": [
        {
          "kimlik": "gpt-4.1",
          "etiket": "GPT-4.1",
          "baglam": 1047576,
          "azami_cikti": 32768
        },
        {
          "kimlik": "gpt-4.1-mini",
          "etiket": "GPT-4.1 mini",
          "baglam": 1047576,
          "azami_cikti": 32768
        },
        {
          "kimlik": "gpt-4o",
          "etiket": "GPT-4o",
          "baglam": 128000,
          "azami_cikti": 16384
        },
        {
          "kimlik": "gpt-4o-mini",
          "etiket": "GPT-4o mini",
          "baglam": 128000,
          "azami_cikti": 16384
        },
        {
          "kimlik": "gpt-5",
          "etiket": "GPT-5",
          "baglam": 400000,
          "azami_cikti": 128000,
          "dusunur": true
        }
      ]
    },
    {
      "kimlik": "azure_openai",
      "ad": "Azure OpenAI",
      "lehce": "openai_chat",
      "adres": "https://KAYNAK.openai.azure.com/openai/v1",